"sentence","startTime","endTime","speaker_id","speaker_name"
"These are like our key contractors or key outside vendors that we really want to keep as a long term relationship.","42:34","42:40",1,"Matt Yonkman"
"When we have extra money, let's pay them, let's communicate to them that we're having issues but we want to keep them.","42:40","42:45",1,"Matt Yonkman"
"And then tier three are the ones like sorry, we can't pay you for six months.","42:45","42:49",1,"Matt Yonkman"
"Like we'll come up with a payment plan but kind of compartmentalizing those different ones and then trying to figure out what we need to raise to pay off or what we need to do to make things last until the next payday, next big grant or something.","42:49","43:06",1,"Matt Yonkman"
"Okay.","43:07","43:07",0,"Steve Simpson"
"If you were to modularize or tier this product, we've kind of looked at a spreadsheet that could represent the core original of just like every week, every two weeks.","43:08","43:22",0,"Steve Simpson"
"I mean, I don't know how often you guys do it or think through it given that it sounds like you have a fairly well automated system.","43:22","43:30",0,"Steve Simpson"
"But you know, if you were going to say like core rituals is C100 what's coming in and how much I have in the bank next levels, you know, is it smarter ap?","43:30","43:41",0,"Steve Simpson"
"I guess now I'm trying to think this new gap of being mainly an observer, not an Actor.","43:43","43:47",0,"Steve Simpson"
"And I really thought like, what do you have to build to keep people out of QuickBooks?","43:49","43:53",0,"Steve Simpson"
"So they feel like the QuickBooks for the compliant side of bookkeeping and tax.","43:53","43:59",0,"Steve Simpson"
"And I just need a decision of like they're already working out of a sauna.","43:59","44:03",0,"Steve Simpson"
"I just want more, one more place.","44:03","44:04",0,"Steve Simpson"
"Originally I was thinking this would be a tool for the owners to like, you know, just help me think my cash decisions a little bit smarter than the bank account.","44:05","44:14",0,"Steve Simpson"
"Now thinking from the advisor side, maybe there's more layers.","44:15","44:20",0,"Steve Simpson"
"But like I hadn't really thought about the sports.","44:20","44:27",0,"Steve Simpson"
"The 13 week forecasting that seemed like it's its own special tool.","44:27","44:32",0,"Steve Simpson"
"There's a couple players out there doing that.","44:32","44:34",0,"Steve Simpson"
"You know, that's why I was thinking like you actually just make the bill pay decisions and run the invoices down.","44:36","44:43",0,"Steve Simpson"
"Sorry to be thinking this out loud.","44:43","44:45",0,"Steve Simpson"
"I mean, what would you pay for?","44:48","44:49",0,"Steve Simpson"
"Just more of an observer experience.","44:49","44:51",0,"Steve Simpson"
"It does sound like you can sell.","44:51","44:52",0,"Steve Simpson"
"You're thinking of selling this as an advisory.","44:53","44:55",0,"Steve Simpson"
"So this like a value add perspective.","44:55","44:57",0,"Steve Simpson"
"So I wasn't thinking as much on the advisory side.","44:59","45:01",0,"Steve Simpson"
"More of the outsourced accounting.","45:01","45:04",0,"Steve Simpson"
"Yeah.","45:06","45:07",1,"Matt Yonkman"
"So we operate in this niche of nonprofits where it's not like some guy running a law firm and has billable hours and kind of has a consistent inflow and consistent outflows.","45:07","45:21",1,"Matt Yonkman"
"A non profit might be, hey, we need to go solicit a million dollars this year.","45:22","45:26",1,"Matt Yonkman"
"We're operating at like three months at a time.","45:27","45:30",1,"Matt Yonkman"
"Like that's all the cash reserve we have.","45:30","45:32",1,"Matt Yonkman"
"We have to keep it going.","45:32","45:33",1,"Matt Yonkman"
"It's more important for nonprofits.","45:35","45:37",1,"Matt Yonkman"
"Like every year they got to get a budget approved.","45:37","45:39",1,"Matt Yonkman"
"Every year we're reporting against it.","45:40","45:42",1,"Matt Yonkman"
"People that are uncertain about their future want forecasting.","45:43","45:46",1,"Matt Yonkman"
"So like they want to project.","45:47","45:48",1,"Matt Yonkman"
"Okay, we've got this in staffing.","45:48","45:52",1,"Matt Yonkman"
"We're going to consider doing this program.","45:52","45:55",1,"Matt Yonkman"
"We need to hire one person.","45:55","45:56",1,"Matt Yonkman"
"What does that do to our forecast for the rest of the year?","45:56","45:59",1,"Matt Yonkman"
"So there's like playing with variables as part of the forecasting, but just having a general, a tool that looks at QuickBooks, all the inputs in there, identifies trends for certain vendors that are always $20 a month.","46:00","46:15",1,"Matt Yonkman"
"Like you can push that out, forecast that into the future.","46:15","46:18",1,"Matt Yonkman"
"Payroll is always a trend, puts that into the future and you kind of look ahead to see where you're at.","46:19","46:26",1,"Matt Yonkman"
"But then there's the question of I want to do this.","46:26","46:28",1,"Matt Yonkman"
"How does that affect what we had originally budgeted, which is now the forecast when we're looking ahead like that.","46:28","46:34",1,"Matt Yonkman"
"So, so we're getting involved in a lot more budgeting and forecasting then like the for profit sectors you're looking at because they're like they've got more of a recurring business.","46:35","46:48",1,"Matt Yonkman"
"Mrr.","46:49","46:49",1,"Matt Yonkman"
"Sorry.","46:50","46:51",0,"Steve Simpson"
"This was the tool I was referencing earlier.","46:51","46:54",0,"Steve Simpson"
"I think it's built on top of QuickBooks.","46:56","46:59",0,"Steve Simpson"
"QuickBooks just released their own forecasting module.","46:59","47:03",0,"Steve Simpson"
"It's supposed to be for that competitor to the this in this sense, I don't think there's any sort of actions taken.","47:03","47:10",0,"Steve Simpson"
"It's more like the trend lines, gaps, assumptions, that kind of stuff.","47:10","47:13",0,"Steve Simpson"
"And I think you said you had done Fathom, which I guess is kind of QuickBooks's internal like analytics that they released as its own company.","47:15","47:30",0,"Steve Simpson"
"Is that true?","47:33","47:34",0,"Steve Simpson"
"Not the background like you use this tool for like basic reporting.","47:34","47:38",0,"Steve Simpson"
"Oh, sorry to switch over.","47:39","47:41",0,"Steve Simpson"
"So I haven't seen Float before, but we do have some use with Fathom when we've looked at tools in the past.","47:42","47:51",1,"Matt Yonkman"
"The pieces that are missing is being able to input changes like future scenarios, but also making it easy for clients to do it as well.","47:51","48:02",1,"Matt Yonkman"
"So that's where we usually end up in spreadsheets, walking them through on a spreadsheet, asking them to input manual numbers like on the spreadsheet I shared with you to kind of get us because they have information we don't have about their relationships with their major donors and stuff like that we need to account for, which you can't see in the trends and QuickBooks, which a lot of these tools are not helpful with us for that because we need those chunky pieces that aren't represented in the history.","48:02","48:31",1,"Matt Yonkman"
"Yeah, I can imagine.","48:35","48:36",0,"Steve Simpson"
"The questions I was going to ask is like how are you getting stray invoices or bills into QuickBooks?","48:37","48:45",0,"Steve Simpson"
"But it sounds like yours is even more intense, that it's like all ephemeral, it's all an email.","48:45","48:50",0,"Steve Simpson"
"It's, you know, it's all.","48:50","48:51",0,"Steve Simpson"
"Yeah, well, you have given me so much extra time and I really appreciate it.","48:53","49:00",0,"Steve Simpson"
"I. I don't want to take advantage of it.","49:00","49:03",0,"Steve Simpson"
"But, you know, any parting words of wisdom, you know, to tide me over for the next couple weeks, months.","49:03","49:10",0,"Steve Simpson"
"I'm not sure actually like what kind of cadence you'd like to follow up on, but one, thank you and two, every conversation super instructive.","49:10","49:19",0,"Steve Simpson"
"Yeah, no, I think what you're working on, I don't know what is out there compared to you.","49:21","49:28",1,"Matt Yonkman"
"I didn't know about Float.","49:28","49:30",1,"Matt Yonkman"
"So there's some gaps maybe in our knowledge of tools that are maybe doing some of the things that were looking for, which is helpful, but maybe not solving the same problem.","49:30","49:40",1,"Matt Yonkman"
"So interested to see where you go with this, but yeah, hard for me to say anything more without like a initial kind of mock up of where you end up going between the two the options and CPA sides you have here.","49:40","49:56",1,"Matt Yonkman"
"Yeah, it does sound like there's very two different needs that we're discovering.","49:57","50:01",0,"Steve Simpson"
"I would check out like QuickBooks has supposedly upgraded their cash flow forecasting in response to several apps building on top of Rome and doing fairly well it seems.","50:01","50:13",0,"Steve Simpson"
"But Float also seems to be like top brand around this forecast.","50:13","50:18",0,"Steve Simpson"
"Well Matt, thanks so much man.","50:21","50:23",0,"Steve Simpson"
"Have a great Friday and look forward to talking again sometime soon.","50:23","50:27",0,"Steve Simpson"
"Awesome.","50:28","50:28",1,"Matt Yonkman"
"Thanks Steve.","50:28","50:29",1,"Matt Yonkman"
"Thank you.","50:29","50:30",0,"Steve Simpson"
"Ciao.","50:30","50:30",0,"Steve Simpson"
"By.","50:30","50:31",0,"Steve Simpson"
"","",,,
"meeting created at","3rd Oct, 2025 - 10:00 AM",,,